cik,sic,company,loc
0001194331,6189,"CWABS INC  ASSET BACKED CERTIFICATES SERIES 2002 3",CA
0001194344,6189,"INDYMAC ABS INC HOME EQ MORT LOAN AS BACK TR SER SPMD 2002 B",CA
0001194356,6189,"CSFB MORTGAGE BACKED PASS THROUGH CERTS SERIES 2002 AR27",NY
0001194585,6189,"STRUCTURED ASSET MORT INV INC BEAR STEARNS ARM TRUST 2002-9",NY
0001194621,6189,"STRUCTURED ASSET SECURITIES CO MOR PASS-THR CER SER 2002-19",NY
0001194626,6189,"CWABS INC ASSET-BACKED CERTIFICATES SERIES 2002-SC1",CA
0001194627,6189,"HOME EQUITY ASSET TRUST 2002-3",NY
0001194886,6189,"STRUCTURED ASSET MORT INV MORT PASS THR CERT SER 2002-4",NY
0001194951,6189,"CWMBS INC MORTGAGE PASS THROUGH CERTIFICATES SERIES 2002-24",CA
0001194952,6189,"CWMBS INC MORTGAGE PASS THROUGH CERTIFICATES SERIES 2002-23",CA
0001194953,6189,"CWMBS INC MORTGAGE PASS THROUGH CERTIFICATES SERIES 2002-28",CA
0001194954,6189,"CWMBS INC MORTGAGE PASS THROUGH CERTIFICATES SERIES 2002-20",CA
0001194956,6189,"CWMBS INC CHL MORTGAGE PASS THROUGH TRUST 2002-18",CA
0001194957,6189,"CWMBS INC CHL MORTGAGE PASS THROUGH TRUST 2002-J4",CA
0001194958,6189,"CWABS INC ASSET BACKED CERTIFICATES SEREIS 2002-4",CA
0001194990,6189,"CWABS INC ASSET BACKED CERTIFICATES SERIES 2002 S3",CA
0001195050,6189,"STRUCTURED ASSET SEC CORP MORT PASS THR CERT SER 2002-BC7",NY
0001195105,6189,"CSFB MORTGAGE BACKED PASS THROUGH CERT SERIES 2002-26",NY
0001195137,6189,"MORTGAGE ASSET SEC TRANS INC MORT PASS THR CERT SER 2002-6",NY
0001195141,6189,"FINANCIAL ASSET SEC CORP ASSET BACKED CERTS SERIES 2002-1",CT
0001195357,6189,"LONG BEACH SEC CORP MORTGAGE LOAN TRUST 2002-4",CA
0001195542,6189,"MERRILL LYNCH DEPOSITOR INC PREFERREDPLUS TRUST SERIES UPC 1",NY
0001195544,6189,"MORTGAGE ASSSET SEC TRANS  INC MASTR ALTERNATIVE LOAN 2002-2",NY
0001195550,6189,"CWMBS INC CHL MORTGAGE PASS THROUGH TRUST 2002-19",CA
0001196073,6189,"MORTGAGE ASSET SEC TRANS  INC MORT PASS THR CERT SER 2002-4",NY
0001196331,6189,"REGIONS ACCEPTANCE LLC",AL
0001196537,6189,"VAL VERDE GAS GATHERING CO LP",TX
0001196707,6189,"MERRILL LYNCH DEPOSITOR INC PREFERREDPLUS TRUST SERIES FAR-1",NY
0001197968,6189,"ACE SECURITIES CORP HOME EQUITY LOAN TRUST SERIES 2002-HE2",NC
0001198813,6189,"JP MORGAN CHASE COM MORT SEC CORP PAS THR CRT SER 2002 CIBC5",MA
0001199301,6189,"FIRST HORIZON MORTGAGE PASS THRU TRUST 2002-AR1",TX
0001199302,6189,"FIRST HORIZON MORTGAGE PASS THRU CERT SER 2002-6",TX
0001199369,6189,"GS MORTGAGE SECURITIES CORP MORT PAS THR CERT SE 2002 WF",NY
0001199403,6189,"AMERICREDIT AUTOMOBILE RECEIVABLES TRUST 2002-C",TX
0001199418,6189,"AMERICREDIT AUTOMOBILE RECEIVABLES TRUST  2002 - D",TX
0001199474,6189,"DEUTSCHE ALT-A SECURITIES INC","  "
0001199476,6189,"DEUTSCHE MORTGAGE SECURITIES INC","  "
0001200126,6189,"DAIMLERCHRYSLER AUTO TRUST 2002-C",MI
0001200136,6189,"ASSET BACKED SEC CORP PASS THROUGH CERTIFICATES SER 2002-HE3",NY
0001200402,6189,"WELLS FARGO ASSET SECURITIES CORP MORT PAS THR CERT SE 02 19",MD
0001200408,6189,"LEHMAN ABS CORP CORP BACKED TRUST CERTS SER 02 17 CLASS A1",NY
0001200606,6189,"FIRST HORIZON MORTGAGE PASS THROUGH TRUST 2002AR1","  "
0001200828,6189,"WAMU MORTGAGE PASS THROUGH CERTIFICATES SERIES 2002-AR17",WA
0001200829,6189,"WAMU MORTGAGE PASS THROUGH CERTIFICATES SERIES 2002-AR15",IL
0001201113,6189,"WAMU MORTGAGE PASS THROUGH CERTIFICATES SERIES 2002-AR16",IL
0001201139,6189,"BANK OF AMERICA MORTGAGE SEC INC MORT PS THR CRT SER 2002-10",NC
0001201376,6189,"MORGAN STANLEY DEAN WITTER CAPITAL I INC SERIES 2002-NC5",NY
0001201478,6189,"MERRILL LYNCH DEPOSITOR INC PREFERREDPLUS TRUST SERIES GEC 1",NY
0001201846,6189,"STRUCTURED PRODUCTS CORP CORTS TRUST GE GLOBAL INS NOTES",NY
0001201847,6189,"WAMU MORTGAGE PASS THROUGH CERTIFICATES 2002-S7",IL
0001201859,6189,"CENDANT MORTGAGE CAPITAL CDMC MORT PASS THR CERT SER 2002-8",NJ
0001201861,6189,"ABFC MORTGAGE LOAN ASSET BACKED CERTIFICATES SERIES 2002 WF2",NC
0001201864,6189,"CSFB MORT SEC CORP COMM MORT PAS THR CERT SER 2002 CKS4",NY
0001201868,6189,"IMH ASSETS CORP IMPACT CMB TRUST SERIES 2002-7",CA
0001201972,6189,"GS MORTGAGE SECURITIES CORP MORT PAS THR CERTS SER 2002-10",NY
0001202055,6189,"WASHINGTON MUTUAL MSC MORTGAGE PASS THRO CERT SER 2002-MS7",IL
0001202178,6189,"AMERICREDIT AUTOMOBILE RECEIVABLES TRUST 2002-E-M",TX
0001202179,6189,"FIRST HORIZON ASSET SEC INC MOR PAS THR CERT SERIES 2002 7",TX
0001202186,6189,"STRUCTURED ASSET SECURITIES CORP II",NY
0001202187,6189,"CSFB MORTGAGE BACKED PASS THROUGH CERTS SERIES 2002-29",NY
0001202188,6189,"MORTGAGE ASSET SEC TRANS INC MORT PAS THR CERT SER 2002-NC1",NY
0001202189,6189,"OPTION ONE MORTGAGE ACCEPT CORP ASSET-BACKED CERT SE 2002-6",CA
0001202235,6189,"STRUCTURED ASSET SEC MORT PASS THRU CERT SER 2002-22H",NY
0001202260,6189,"STRUCTURED ASSET SEC MORT PASS THRU CERT SER 2002-21A",NY
0001202498,6189,"HOME EQUITY PASS THROUGH CERTIFICATES SERIES 2002-4",NY
0001202500,6189,"BRISTOL MYERS SQUIBB DEBENTURE BACKED SERIES 2002-18",NY
0001202505,6189,"GS MORTGAGE SECURITIES CORP MORT  PASS THR CE SER  2002-11F",NY
0001202536,6189,"MORTGAGE ASSET SEC TRANS INC MORT PASS THR CERT SER 2002-7",NY
0001202558,6189,"MORGAN STANLEY DEAN WITTER CAPITAL I INC SERIES 2002-AM3",NY
0001202609,6189,"VOLKSWAGEN AUTO LEASE TRUST 2002-A","  "
0001202610,6189,"VW CREDIT LEASING LTD","  "
0001202818,6189,"STRUCTURED ASSET MORT INV INC BEAR STEARNS ARM TRUST 2002-10",NY
0001202825,6189,"STRUCTURED ASSET SEC CORP MORT PASS THR CERTS SER 2002-BC8",NY
0001202827,6189,"CWMBS INC CHL MORTGAGE PASS THROUGH TRUST 2002-29",CA
0001202828,6189,"CWMBS INC CHL MORTGAGE PASS THROUGH TRUST 2002-27",CA
0001202829,6189,"CWMBS INC CHL MORTGAGE PASS THROUGH TRUST 2002-25",CA
0001202830,6189,"STRUCTURED ASSET SECURITIES CORP MOR PA TH CE SE 2002 23XS",NJ
0001202832,6189,"CWMBS INC CHL MORTGAGE PASS THROUGH TRUST 2002-26",CA
0001202834,6189,"CWMBS INC CHL MORTGAGE PASS THROUGH TRUST 2002-30",CA
0001202835,6189,"BEAR STEARNS ASSET BK SEC INC SERIES 2002-AC5",NY
0001202937,6189,"RESIDENTIAL ASSET MTG PRODUCTS GMACM MTG LOAN TR SER 2002-J6",MN
0001203054,6189,"EQUITY ONE ABS INC EQUITY ONE MORTGAGE PASS-THR TRUST 2002-5",DE
0001203085,6189,"LONG BEACH SECURITIES CORP ASSET BACKED CERTS SERIES 2002-5",CA
0001203090,6189,"STRUCTURED ASSET SEC CORP MORT PASS THR CERT SER 2002 HF2",NY
0001203092,6189,"CSFB MORTGAGE BACKED PASS THR CERTS SERIES 2002-AR28",NY
0001203116,6189,"STRUCTURED ASSET MORTGAGE INVEST MRT PSTHR CERT SER 2002-4",NY
0001203436,6189,"SSB VEHICLE SECURITIES INC SSB AUTO LOAN TRUST 2002-1",NY
0001203437,6189,"DVI RECEIVABLES CORP VIII DVI FINANCIAL SERVICES INC",PA
0001203584,6189,"CHASE CREDIT CARD OWNER TRUST 2002-7",DE
0001203941,6189,"WACHOVIA COMMERCIAL MORT PASS THRU CERT SER 2002-C2",NC
0001204326,6189,"PHEAA STUDENT LOAN TRUST I",DE
0001204350,6189,"PHEAA STUDENT LOAN FOUNDATION INC",PA
0001204505,6189,"C BASS MORTGAGE LOAN ASSET BACKED CERT SERIES 2002-CB5",NC
0001204932,6189,"LEHMAN ABS CORP REPAC GE GLOB INS FLT RT TR CERT SER 2002-1",NY
0001205061,6189,"CARMAX AUTO OWNER TRUST 2002-2",VA
0001205512,6189,"GE CAPITAL COMMERCIAL MORT CORP COM MORT PAS TH CE SE 2002 3",MD
0001205548,6189,"SAXON ASSET SECURITIES CO MORT LN AS BACK CERT SE 2002 3",VA
0001205557,6189,"DVI RECEIVABLES XVIII LLC",PA
0001205577,6189,"MELLON RESIDENTIAL FUNDING CORP MORT PAS THR CE SE 02 TBC2",PA
0001205627,6189,"HFC REVOLVING CORP  HOUSEHOLD HOME EQUITY LOAN TRUST 2002 4",IL
0001205734,6189,"SLC STUDENT LOAN ASSET BACKED NOTES SERIES 2002-2",CT
0001205736,6189,"CHASE CREDIT CARD OWNER TRUST 2002-8",DE
0001206066,6189,"NEW SOUTH MOTOR VEHICLE  TRUST 2002-A",AL
0001206209,6189,"BANK OF AMERICA MORT SEC MORT PASS THRU CER SER 1998-6",NC
0001206211,6189,"BANK OF AMERICA MORT SEC INC MORT PASS THRU CER SER 1998-7",NC
0001206222,6189,"CSFB HOME EQUITY  MORTGAGE PASS THROUGH CERT SERIES 2002-4",NY
0001206251,6189,"JP MORGAN CHASE COM MORT SEC CORP PASS THR CE SE 2002-C2",MA
0001206252,6189,"HONDA AUTO RECEIVABLES 2002-4 OWNER TRUST",CA
0001206477,6189,"REGIONS AUTO RECEIVABLES TRUST 2002-1",AL
0001206567,6189,"STRUCTURED ASSET MORT  INV INC MORT PASS THR CRT SR 2002-AR4",NY
0001206816,6189,"WFS FINANCIAL 2002 4 OWNER TRUST",NV
0001207209,6189,"WASHINGTON MUTUAL MORT SEC CORP WAMU MO PA TH CER SE 02 AR18",IL
0001207231,6189,"FIRST HORIZON ASSET SEC INC MORT PASS THR CERT SER 2002 AR2",TX
0001207286,6189,"MORGAN STANLEY DEAN WITTER CAPITAL TRUST 2002 IQ3",NY
0001207409,6189,"BANC OF AMERICA MORTGAGE SECURITIES INC",NC
0001207420,6189,"HOUSEHOLD AUTO RECEIVABLES CORP SERIES 2002-2",IL
0001207425,6189,"WAMU MORTGAGE PASS THRU CERTIFICATES SERIES 2002-MS8",IL
0001207426,6189,"WAMU MORTGAGE PASS THRU CERTIFICATES SERIES 2002-MS9",IL
0001207427,6189,"WELLS FARGO ASSET SEC CORP MORT PASS THR CERT SER 2002-20",MD
0001207492,6189,"HOUSEHOLD AUTO RECEIVABLES CORP ASSET BACKED NTS SRS 2002-3",IL
0001207516,6189,"ACCREDITED HOME LENDERS ACCREDITED MORT LOAN TRUST 2002-2",IL
0001207595,6189,"HOMEPRIDE MORTGAGE FINANCE CORP","  "
0001207781,6189,"STRUCTURED ASSET SEC CORP MORT PASS THR CERT SER 2002-25A",NY
0001207784,6189,"WASHINGTON MUTUAL MSC MORTGAGE PASS THR CERT SER 2002-AR3",WA
0001207797,6189,"STRUCTURED ASSET SEC CORP MORT PASS THR CERT SER 2002-FF3",NY
0001207799,6189,"IMPAC CMB TRUST SERIES 2002-8",CA
0001207852,6189,"BANC OF AMERICA FUNDING CORP MORT PASS THR CERT SER 2002-2",MD
0001207971,6189,"THORNBURG MORTGAGE SECURITIES TRUST 2002-4",NY
0001207973,6189,"CSFB MORTGAGE BACKED PASS THR CERT SER 2002-30",NY
0001208016,6189,"ABN AMRO MORTGAGE CORP MUTIL CLASS SERIES 2002-9",IL
0001208022,6189,"STRUCTURED ASSET SEC CORP MORT PASS THR CERT SER 2002-BC1",NY
0001208027,6189,"MORGAN STANLEY ABS CAP I INC MRT PSS THR CERT SE 2002-HE3",NY
0001208028,6189,"MORGAN STANLEY ABS CAP I INC MRT PSS THR CERT SER 2002-NC6",NY
0001208029,6189,"GS MORTGAGE SECURITIES CORP MORT PA TH CE SE 2002-HE",NY
0001208071,6189,"MORGAN STANLEY ABS CAPITAL I INC TRUSTS 2002 HE3",NY
0001208072,6189,"MORTGAGE ASSET SEC TRANS INC MORT PASS THR CERT SER 2002-8",NY
0001208088,6189,"MORTGAGE ASSET SEC TRANS INC MORT PASS THR CERT SER 2002-3",NY
0001208101,6189,"GREENWICH CAPITAL ACCEPT INC MORT LN PAS THR CERT SE 02 FRB2",MD
0001208102,6189,"FIRST HORIZON ASSET SEC INC MORT PAS THR CE SE 2002-8",TX
0001208136,6189,"BANK OF AMERICA MORT SEC INC MORT PASS THRU CER SER 1999-7","  "
0001208137,6189,"BANK OF AMERICA MORT SEC INC MORT PASS THRU SER 2000-1","  "
0001208138,6189,"BANK OF AMERICA MORT SEC INC MORT PASS THRU SER 2000-2","  "
0001208139,6189,"BANK OF AMERICA MORT SEC INC MORT PASS THRU SER 2000-3","  "
0001208140,6189,"BANK OF AMERICA MORT SEC INC MORT PASS THRU SER 2000-4","  "
0001208253,6189,"MLMI 2002- A 3",NY
0001208266,6189,"CHL MORTGAGE PASS THROUGH TRUST 2002-34",CA
0001208270,6189,"CHL MORTGAGE PASS THROUGH TRUST 2002-31",CA
0001208271,6189,"MORTGAGE PASS THROUGH CERTIFICATES SERIES 2002-33",CA
0001208272,6189,"CHL MORTGAGE PASS THROUGH TRUST 2002-32",CA
0001208273,6189,"CHL MORTGAGE PASS THROUGH TRUST 2002-36",CA
0001208310,6189,"MORTGAGE ASSET SEC TRANS INC MORT PAS THR CER SER 2002-OPT1",NY
0001208368,6189,"CREDIT SUISSE FIRST BOSTON MOR SEC CORP COM CER SER 2002-CP5",MD
0001208416,6189,"VANDERBILT MORT & FIN INC SENIOR SUB PAS THR CERT SER 2002-C",TN
0001208417,6189,"STRUCTURED ASSET SEC CORP MORT PASS THR CERT SER 2002-24",NY
0001208432,6189,"STRUCTURED ASSET SEC CORP MORT PASS THR CERT SER 2002-BC9",NY
0001208477,6189,"CSFB MORTGAGE-BACKED PASS-THROUGH CERTIFICATES SER 2002-AR31",NY
0001208711,6189,"CAPITAL ONE AUTO FINANCE TRUST 2002-C",VA
0001208771,6189,"BEAR STEARNS ASSET BACKED FUND INC WHOLE AUTO LOAN TR 2002-1",NY
0001209003,6189,"MERRILL LYNCH MORTGAGE INV INC MOR LN AST BCK CE SE 2002 HEI",NY
0001209192,6189,"JP MORGAN CHASE COM MORT SEC CORP PAS THR CER SER 2002-C2",MA
0001209252,6189,"ABN AMRO MORTGAGE CORP SERIES 2002-9",IL
0001209398,6189,"GRANITE MORTGAGES 03-1 PLC","  "
0001209590,6189,"ACE SECURITIES CORP HOME EQ LN TR SE 02 HE3 AS BK PS TR CRT",NC
0001209655,6189,"JP MORGAN CHASE COM MORT SEC CORP PT CERTS SERIES 02 C3",MA
0001209809,6189,"AAMES CAPITAL CORP MORTGAGE PASS THROUGH CERTS SER 2002 2",CA
0001209914,6189,"HOUSEHOLD AFFINITY FUNDING CORP III",IL
0001210003,6189,"ABFS MORTGAGE LOAN TRUST 2001-4 MORT-BACKED NOTES SER 2001-4",NY
0001210005,6189,"ABFS MORTGAGE LOAN TR 2001-2 MORT PASS-THR CERT SER 2001-2",NY
0001210129,6189,"STRUCTURED ASSET SEC CORP II COM MORT PAS THR CERT SE 02 C7",NY
0001210198,6189,"GOLDMAN SACHS ASSET BACKED SECURITIES CORP","  "
0001210492,6189,"RESIDENTAIL ASSET MORT PRODUCTS GMACM MORT LN TR SERS 2002J7","  "
0001210556,6189,"WELLS FARGO ASSET SEC CORP MORT BACKED SEC 2002-22 TRUST",MD
0001210566,6189,"WACHOVIA ASSET SECURITIZATION INC 2002 HE2 TRUST",MD
0001210938,6189,"BANK OF AMERICA MORT SEC INC MORT PASS-THR CERT SER 2002-L",MD
0001211039,6189,"CREDIT SUISSE FIRST BOSTON MORT SEC CORP HO EQ MO TR 2002-5",NY
0001211059,6189,"CREDIT SUISSE FIRST BOSTON MOR ACC COR HO EQ ASSET TR 2002-5",NY
0001211134,6189,"PERMANENT FINANCING NO 2 PLC",X0
0001211244,6189,"WAMU MORTGAGE PASS THROUGH CERT SERIES 2002-S8",IL
0001211311,6189,"WASHINGTON MUTUAL MSC MORTGAGE PASS THR CERT SER 2002 MS12",IL
0001211514,6189,"FINANCIAL ASSET SECS CORP FIRST FRANKLIN MORT LN TR 2002-FF4",CT
0001211517,6189,"WASHINGTON MUTUAL MSC MORT PAS THR CERT SER 2002 MS11",IL
0001211522,6189,"WAMU MORTGAGE PASS THROUGH CERT SER 2002-AR19",IL
0001211571,6189,"ABFS MORT LOAN TRUST 2002-4 MORT PASS THRU CERT SER 2002-4",NY
0001211573,6189,"WASHINGTON MUTUAL MSC MORT PASS THRU CERT SER 2002-MS10",IL
0001211575,6189,"WELLS FARGO MORTGAGE BACKED SECURITIES 2002-18 TRUST",MD
0001211678,6189,"CWABS INC ASSET BACKED CERTIFICATES SERIES 2002 5",CA
0001211731,6189,"STRUCTURED PRODUCTS CORP CORTS TRUST FOR GE CAP CORP",NY
0001211755,6189,"ASSET BACKED SEC CORP HOME EQU LOAN TR SER 2003-HE1",NY
0001211789,6189,"COLLEGIATE FUNDING OF DELAWARE LLC",VA
0001211863,6189,"IMH ASSETS CORP IMPAC CMB TRUST SERIES 2002 9F",CA
0001211873,6189,"CSFB MORTGAGE ACCEPTANCE CORP MORT PA THR CERT SER 2002-FTB1",NY
0001211926,6189,"ABN AMRO MORTGAGE CORP MUL CLASS MOR PASS THR CE SER 2002-10",IL
0001211933,6189,"STRUCTURED ASSET SEC CORP MORTGAGE PAS THR CERT SE 2002-27A",NY
0001211934,6189,"FINANCIAL ASSET SEC CORP C BASS MORT LN AS BK CE SE 02-CB6",CT
0001211938,6189,"CWABS INC ASSET BACKED CERTIFICATES SERIES 2002 S4",CA
0001211974,6189,"EDUCATION FUNDING CAPITAL TRUST I",OH
0001211981,6189,"RENAISSANCE HOME EQUITY LOAN TR  ASSET BKD CER SER 2002-4",NY
0001212034,6189,"STRUCTURED ASSET MORTGAGE INVESTMENTS TRUST 2002-3",MN
0001212106,6189,"SALOMON BROTHERS MORT SEC VII INC SOV BK MRT LN TR SE 2002-1",NY
0001212117,6189,"ONYX ACCEPTANCE OWNER TRUST 2002-D",CA
0001212123,6189,"GS MORTGAGE SEC CORP MORT PASS THR CERT SER 2002-HE2",NY
0001212124,6189,"FLEET MORTGAGE CERTIFICATE TRUST 2001-1",NY
0001212132,6189,"FIRST HORIZON ASSET SEC INC MORT PASS THR CERT SER 2002-9",TX
0001212135,6189,"CWMBS INC MORTGAGE PASS THR CERT SER 2002-37",CA
0001212136,6189,"STRUCTURED ASSET SEC CORP MORT PASS THR CERT SER 2002-26",NJ
0001212137,6189,"STRUCTURED ASSET SEC CORP MORT PASS THR CERT SER 2002-BC10",NJ
0001212239,6189,"CREDIT SUISSE FIRST BOSTON MORT BACK PS THR CERT SER 2002-34",NY
0001212261,6189,"CWABS INC ASSET BACKED CERTIFICATES SERIES 2002-6",CA
0001212266,6189,"STRUCTURED ASSET MORT INV INC MORT PS THR CERT SER 2002-AR5",NY
0001212267,6189,"CSFB MORTGAGE BACKED PASS THR  CERTS SERIES 2002-AR33",NY
0001212297,6189,"STRUCTURED ASSET MORT INV INC MORT PASS THR CERT SER 2002-2",NY
0001212298,6189,"CWMBS INC CHL MORTGAGE PASS THROUGH TRUST 2002-J5",CA
0001212299,6189,"CWMBS INC CHL MORTGAGE PASS THROUGH TRUST 2002-38",CA
0001212300,6189,"CWMBS INC CHL MORTGAGE PASS THROUGH TRUST 2002-39",CA
0001212438,6189,"FINANCIAL ASSET SEC CORP ASSET BACKED CERTS SER 2002-2",CT
0001212444,6189,"DEUTSCHE MORTGAGE SECURITIES INC MORT LOAN TRUST SER 2002 1","  "
0001212448,6189,"STRUCTURED ASSET MORT INV INC BEAR STEARNS ARM TRUST 2002-12",NY
0001212465,6189,"STRUCTURED ASSET MORT INV INC BEAR STEARNS ARM TRUST 2002-11",NY
0001212637,6189,"CWMBS INC CHL MORTGAGE PASS THROUGH TRUST 2002-35",CA
0001212755,6189,"CHASE CREDIT CARD OWNER TRUST 2003-1",DE
0001213504,6189,"MERRILL LYNCH MORTGAGE INVESTORS INC MOR PA THR CE SE 2002-H","  "
0001213506,6189,"MORTGAGE ASSET SECURITIES TRANSACTIONS INC MOR PA THR CE SE","  "
0001214153,6189,"GCO ELF LLC",NY
0001214159,6189,"GCO Education Loan Funding Trust-I",CO
0001214802,6189,"MERRILL LYNCH DEPOSITOR INC PREFERREDPLUS TRUST SERIES GRC 1",NY
0001214803,6189,"IMH ASSETS CORP IMPAC  CMB TRUST SERIES 2002 6F",CA
0001214899,6189,"MORGAN STANLEY DEAN WITTER CAPITAL I INC SER 2003 TOP9",NY
0001215020,6189,"OPTION ONE MORT ACCEPT CORP ASSET BACKED CERTS SER 2003 1",CA
0001215087,6189,"GE COMMERCIAL MORTGAGE CORP",CT
0001215163,6189,"LEHMAN HOME EQUITY LOAN TRUST 2002-1",NY
0001215332,6189,"PPLUS TRUST SERIES PMC-1",NY
0001215751,6189,"COLLEGE LOAN CORP",CA
0001216019,6189,"MORGAN STANLEY DEAN WITTER CAP I MRT PS THR CRT SER 2003 NC1",NY
0001216046,6189,"LEHMAN ABS CORP SEARS ROEBUCK ACCEP NOTE BACK SER 2003-1",NY
0001216057,6189,"WAMU MORTGAGE PASS THROUGH CERTIFICATES SERIES 2003-AR1",WA
0001216063,6189,"NEW CENTURY HOME EQUITY LOAN TRUST SERIES 2003-1",CA
0001216147,6189,"GS MORTGAGE SEC CORP MORT PASS THR CERT SER 2003-1",NY
0001216149,6189,"BANC OF AMERICA MORTGAGE SEC INC MRT PAS THR CERT SER 2003-A",NC
0001216151,6189,"ABN AMRO MORTGAGE CORP MUL CL MORT PASS THR CERT SER 2003-1",IL
0001216152,6189,"CWABS INC ASSET BACKED CERTIFICATES SERIES 2003-BC1",CA
0001216212,6189,"BANC OF AMERICA MORT SEC INC ALTERNATIVE LOAN TRUST 2003-1",NC
0001216225,6189,"WELLS FARGO ASSET SEC CORP  MORT PASS THR CERTS SER 2003-A",MD
0001216238,6189,"BANC OF AMERICA MORT SEC INC MORT PASS THR CERT SER 2003-1",NC
0001216254,6189,"WASHINGTON MUTUAL MORT SEC CORP PAS THR CERTS SER 2003 MS1",WA
0001216277,6189,"LEHMAN ABS CORP BELLSOUTH CAPITAL FUND DEB BK SERS 2003-2",NY
0001216311,6189,"CSFB MORTGAGE SEC CORP HOME EQ MORT PASS THR CERT SER 2003-1",NY
0001216379,6189,"WASHINGTON MUTUAL MSC MORT PA THR CERT SERIES 2003-MS2",WA
0001216402,6189,"WELLS FARGO ASSET SEC CORP MORT PA THR CERT SERIES 2003-C",MD
0001216588,6189,"MASTR ASSET SECURITIZATION TRUST 2003-1",NY
0001216592,6189,"FIRST HORIZON ASSET SEC INC MORT PASS THR CERT SER 2003-1",TX
0001216593,6189,"WASHINGTON MUTUAL MSC MORT PASS THR CERTS SER 2003-AR1",WA
0001216594,6189,"CSFB MORTGAGE SEC CORP HOME EQ PASS THR CERTS SER 2003-1",NY
0001216597,6189,"CWMBS INC CHL MORTGAGE PASS THROUGH TRUST 2003-1",CA
0001216598,6189,"CWMBS INC ALTERNATIVE LOAN TRUST 2003-2CB",CA
0001216620,6189,"ETRADE MORTGAGE BACKED  SECURITIES CORP",VA
0001216790,6189,"ABN AMRO MORTGAGE CORP MUL CL MORT PASS THR CERT SER 2003-1",IL
0001216795,6189,"STRUCTURED ASSET SECURITIES CORP MORT PAS THR CERT SE 03 2A",NY
0001216811,6189,"CWMBS INC CHL MORTGAGE PASS THROUGH TRUST 2003-J1",CA
0001216895,6189,"GREENWICH CAPITAL ACCEP INC MORT LN PS THR CERT SER 2003-1",MD
0001216897,6189,"GREENWICH CAPITAL ACCEPTANCE INC THORN MORT SEC TR 2003-1",MD
0001216926,6189,"IMH ASSETS CORP IMPAC CMB TRUST SERIES 2003-2F",CA
0001216932,6189,"CWMBS INC CHL MORTGAGE PASS THROUGH TRUST 2003-HYB1",CA
0001217000,6189,"FREEDOM DEPOSITORY LLC",TX
0001217001,6189,"CSFB MORTGAGE ACCEPTANCE CORP MORT BACK CERT SER 2003-1",NY
0001217013,6189,"LEHMAN ABS CORP DUKE CAPITAL NOTE BACKED SERIES 2003-3",NY
0001217014,6189,"STRUCTURED ASSET SEC CORP MORT BACK PS THR CERT SER 2003-3XS",NY
0001217017,6189,"STRUCTURED ASSET SEC CORP MORT PASS THR CERTS SERIES 2003-1",NY
0001217024,6189,"IMH ASSETS CORP IPAC CMB TRUST SERIES 2003-1",CA
0001217025,6189,"CWABS INC REVOLVING HM EQ LN AST BACK NOTES SER 2003-A",CA
0001217035,6189,"MERRILL LYNCH DEPOSITOR INC PPLUS TRUST SERIES VAL 1",NY
0001217061,6189,"CSFB MORTGAGE BACK PASS THR CER SER 2003-AR2",NY
0001217064,6189,"MORTGAGE ASSET SECURIT TRANS INC MORT PS THR CERT SER 2003-1",NY
0001217069,6189,"CWMBS INC CHL MORTGAGE PASS THROUGH TRUST 2003-2",CA
0001217078,6189,"INDYMAC MBS INC RESIDENTIAL ASSET SECURIT  TRUST 2003-A1",CA
0001217080,6189,"LONG BEACH SECURITIES CORP ASSET BACKED CERT SERIES 2003-1",CA
0001217254,6189,"MASTER ADJUSTABLE RATE MORTGAGES TRUST 2003-1",NY
0001217630,6189,"CDF FINANCING LLC",MO
0001218064,6189,"HOLMES FINANCING NO 7 PLC",X0
0001218260,6189,"STRUCTURED ASSET SEC CORP MORT PASS THR CERT SER 2003 BC1",NY
0001219082,6189,"CSFB ACCEPTANCE CORP HOME EQUITY LOAN BACK NOTES SER 2003-A",NY
0001219088,6189,"LEHMAN ABS CORP HSBC DEBENTURE BACKED SERIES 2003-4",NY
0001219122,6189,"MERRILL LYNCH DEPOSITOR INC PPLUS TRUST SERIES GSG 1",NY
0001219370,6189,"STRUC PROD CORP TIERS PRIN PRO MIN RET TR CER SER S&P 2003-7",NY
0001219389,6189,"CSFB MORTGAGE SEC CORP COMM MORT PASS THR CERT SER 2003-CPN1",NY
0001219507,6189,"BANC OF AMERICA MORT SEC INC MORT PASS THR CERT SER 2003-B",NC
0001219658,6189,"WELLS FARGO ASSET SEC CORP MORTGAGE PASS THR CERT SER 2003-D",MD
0001219665,6189,"GS MORTGAGE SECURITIES CORP MORT PAS THRU CRTS SRIES 2003-1",NY
0001219701,6189,"EDUCATION FUNDING CAPITAL I, LLC",NE
0001220063,6189,"ONYX ACCEPTANCE OWNER TRUST 2003-A",CA
0001220259,6189,"WAMU MORTGAGE PASS-THRU CERT SERIES 2003-AR2",IL
0001220307,6189,"MERRILL LYNCH MORT INV INC MRT PSS THR CERT MLMI SER 2003-A1",NY
0001220308,6189,"WAMU MORTGAGE PASS THROUGH CERT SER 2003-S1",IL
0001220347,6189,"HONDA AUTO RECEIVABLES 2003-1 OWNER TRUST",CA
0001220366,6189,"WAMU MORTAGE PASS THRU CERT SERIES 2003-AR3",IL
0001220460,6189,"NISSAN AUTO RECEIVABLES 2003-A OWNER TRUST",CA
0001220468,6189,"GS MORTGAGE SEC CORP MORT PASS THR CERT SER 2003 NC1",NY
0001220605,6189,"SENIOR SUBORDINATE PASS THROUGH CERT SERIES 2003-A",TN
0001220662,6189,"CDMC MORTGAGE PASS-THROUGH CERTIFICATES SERIES 2003-1",NJ
0001220664,6189,"WELLS FARGO MORTGAGE BACKED SECURITIES 2003-B TRUST",MD
0001220665,6189,"WELLS FARGO MORTGAGE BACKED SECURITIES 2003-1 TRUST",MD
0001220670,6189,"WACHOVIA COMMERCIAL MORT SEC INC  PAS THR CERTS SER 03 C3",NC
0001220672,6189,"MORGAN STANLEY DEAN WITTER CAPITAL I INC SERIES 2003 NC2",NY
0001220677,6189,"EQUITY ONE ABS INC  EQUITY ONE MORT PASS THR TRUST 2003-1",DE
0001220700,6189,"STRUCTURED PRODUCTS CORP CORTS TRUST IV FOR AON CAPITAL A",NY
0001220769,6189,"IMPAC CMB TRUST COLLATERLIZED AB BOND SERIES 2003-3",CA
0001220772,6189,"WASHINGTON MUTUAL MSC MORT PASS THRU CERT SERIES 2003-MS4",IL
0001220773,6189,"WASHINGTON MUTUAL MSC MORT PASS THRU CERT SERIES 2003-MS7",IL
0001220822,6189,"CWMBS INC CHL MORTGAGE PASS-THROUGH TRUST 2003-3",CA
0001220823,6189,"MORTGAGE ASSET SECURITIZATION TRANSACTIONS INC SER 2003-OPT1",NY
0001220838,6189,"FIRST HORIZON MORTGAGE PASS THRU TRUST 2003-AR1",TX
0001220858,6189,"NOVASTAR MORTGAGE FUNDING CORP HOME EQ LN AS BK CE SE 03 1",NY
0001220914,6189,"SALOMON BROTHERS MORT SEC VII INC MORT LOAN TRUST SE 03 CB1",NY
0001220931,6189,"WELLS FARGO ASSET SEC CORP MORT PASS THR CERT SER 2003-2",MD
0001220970,6189,"WASHINGTON MUTUAL MORTGAGE SEC CORP PAS THRU CERTS 2003MS5",IL
0001220975,6189,"FIRST HORIZON ASSET SECS INC MORT PASS THRU TRUST 2003-2",TX
0001221023,6189,"IMPAC SECURED ASSETS CORP MORTGAGE PASS THR CERT SER 2003-1",CA
0001221025,6189,"ABN AMRO MORT CORP MULTI-CLASS MORT PASS-THR CERT SER 2003-2",IL
0001221031,6189,"CWMBS INC MORTGAGE PASS THROUGH CERTIFICATES SERIES 2003 5",CA
0001221044,6189,"STRUCTURED ASSET SECURITIES CORP MOR PAS THR CER SER 2003-6A",NY
0001221045,6189,"WASHINGTON MUTUAL MSC MORT PASS THROUGH CERT SER 2003-MS3",IL
0001221051,6189,"CSFB MORTGAGE SEC CORP HOME EQ MORT PSS THR CRT SER 2003-FFA",NY
0001221052,6189,"ABN AMRO MORT CORP MULTI CLASS MORT PASS THR CERT SER 2003-3",IL
0001221112,6189,"STRUCTURED PRODUCTS CORP CAST STEP-UP TRUST FOR GECC NOTES",NY
0001221140,6189,"MASTR SEASONED SECURITIZATION TRUST 2003-1",NY
0001221152,6189,"INDYMAC MBS INC RESIDENTIAL ASSET SECURITIZATION TR 2003 A2",CA
0001221159,6189,"BEAR STEARNS ARM TRUST MORTGAGE PASS THROUGH CERT 2003-1",NY
0001221173,6189,"STRUCTURED ASSET SEC CORP MORT PAS THR CERTS SERIES 2003-7H",NY
0001221178,6189,"CWMBS INC MORTGAGE PASS THRU CERTIFICATES SERIES 2003-12",CA
0001221225,6189,"CSFB MORTGAGE BACKED PASS THROUGH CERTIFICATES  SER 2003 7",NY
0001221226,6189,"CWMBS INC CHL MORTGAGE PASS-THROUGH TRUST 2003 4",CA
0001221228,6189,"CWMBS INC CHL MORTGAGE PASS THROUGH TRUST 2003 J2",CA
0001221229,6189,"MORGAN STANLEY DEAN WITTER CAPITAL I INC M P TH C S 03 HYB1",NY
0001221293,6189,"BAYVIEW FINANCIAL SECURITIES CO LLC",FL
0001221357,6189,"CSFB MORT SEC CORP MORT BACKED PASS THR CERTS SERIES 2003 7",NY
0001221358,6189,"CSFB MORT SEC CORP MORT BACKED PASS THR CERTS SER 2003 AR5",NY
0001221382,6189,"PRUDENTIAL SECURITIES SEC FIN CORP COM MORT TR 2003 PWR1",NY
0001221420,6189,"MORTGAGE ASSET SEC TRANSACTIONS INC MASTR ASSET SEC TR 03 2",NY
0001221437,6189,"GS MORTGAGE SEC CORP II COMM MORT PASS THR CERT SER 03 C1",NY
0001221452,6189,"LEHMAN ABS CORP SEARS ROEBUCK ACCEP NOTE BACKED SER 2003 5",NY
0001221461,6189,"STRUCTURED ASSET SEC CORP MORT PASS THR CERTS SER 03 4",NJ
0001221463,6189,"STRUCTURED PRODUCTS CORP TVA TIERS TRUST CERTS SER 03 6",NY
0001221464,6189,"STRUCTURED ASSET INVESTMENT LOAN TRUST 2003-BC1",NY
0001221465,6189,"GS MORTGAGE SECURITIES CORP MORT PASS THR CERTS SER 03 2F",NY
0001221468,6189,"MERRILL LYNCH MORTGAGE INVESTORS TRUST SER MLCC 2003-A",NY
0001221498,6189,"VOLKSWAGEN PUBLIC AUTO LOAN SECURITIZATION LLC","  "
0001221546,6189,"SELECT ASSET INC",NY
0001221563,6189,"CWABS INC ASSET BACKED CERTS SERIES 2003-1",CA
0001221581,6189,"CWABS INC REVOLVING HM EQU LN ASST BACK NTS SER 2003-B",CA
0001221637,6189,"STRUCTURED ASSET SEC CORP MORT PASS THR CERT SER 2003-BC2",NY
0001221684,6189,"CORTS TRUST FOR THE DOW CHEMICAL CO DEBENTURES",NY
0001221757,6189,"MERRILL LYNCH DEPOSITOR INC PPLUS TRUST SERIES FMC-1",NY
0001221842,6189,"GRACECHURCH CARD FUNDING NO 3 PLC","  "
0001221947,6189,"STRUCTURED ASSET SEC CORP II COM MORT PAS THR CER SE 03 C1",NY
0001222099,6189,"AMERIQUEST MORTGAGE SEC INC ASSET BCK PS THR CERT SER 2003-3",CA
