cik,sic,company,loc
0000020164,6189,"CHRYSLER FINANCIAL CORP",MI
0000020947,6189,"CLEVELAND ELECTRIC ILLUMINATING CO",OH
0000036604,6189,"FIRST NATIONAL BANK OF ATLANTA",DE
0000073960,6189,"OHIO EDISON CO",OH
0000100937,6189,"SIGNET BANK /VA/",MD
0000216543,6189,"BNY MELLON N.A.",PA
0000275157,6189,"CALIFORNIA FEDERAL BANK FSB",CA
0000275911,6189,"PROVIDENT BANK",MD
0000314643,6189,"WASHINGTON MUTUAL MORTGAGE SECURITIES CORP",IL
0000316692,6189,"CM CORP",FL
0000316905,6189,"HSBC BANK USA",NY
0000350001,6189,"Company Name Three `!#$(),:;=.-;\|@/{}&'\WA\",VA
0000352049,6189,"TOLEDO EDISON CO",OH
0000740104,6189,"BANK OF AMERICA NATIONAL TRUST & SAVING ASSOCIATION",CA
0000742454,6189,"LEHMAN CMO INC",NY
0000748269,6189,"SALOMON BROTHERS MORTGAGE SECURITIES II INC",TX
0000752302,6189,"GUARANTEED MORTGAGE CORP III",CO
0000754591,6189,"ELLISON RAY MORTGAGE ACCEPTANCE CORP",TX
0000757004,6189,"HALL INSTITUTIONAL MORTGAGE FUND LTD PARTNERSHIP",AZ
0000757078,6189,"PRESIDENTIAL MORTGAGE CO",CA
0000758387,6189,"TRITON CONTAINER INTERNATIONAL LTD",NY
0000761231,6189,"HOME MAC MORTGAGE SECURITIES CORP",NY
0000761631,6189,"SALOMON CAPITAL ACCESS CORP",NY
0000762153,6189,"MORGAN STANLEY DEAN WITTER CAPITAL I INC",NY
0000762852,6189,"COLLATERALIZED MORTGAGE SECURITIES CORP",NY
0000764061,6189,"TECHNOLOGY FUNDING SECURED INVESTORS II",CA
0000764062,6189,"TECHNOLOGY FUNDING SECURED INVESTORS I",CA
0000768600,6189,"NATIONAL MORTGAGE ACCEPTANCE CORP",VA
0000771980,6189,"FSF FINANCE CORP",DE
0000774352,6189,"RESIDENTIAL FUNDING MORTGAGE SECURITIES I INC",MN
0000775748,6189,"COUNTRYWIDE MORTGAGE OBLIGATIONS III INC",CA
0000780148,6189,"WFS FINANCIAL AUTO LOANS INC",CA
0000784013,6189,"ZIEGLER MORTGAGE SECURITIES INC II",WI
0000785818,6189,"MORTGAGE SECURITIES III TRUSTS A",WA
0000786149,6189,"INLAND MORTGAGE INVESTORS FUND LP",IL
0000786156,6189,"SUMMIT TAX EXEMPT BOND FUND LP",NY
0000786622,6189,"KRUPP INSURED PLUS LTD PARTNERSHIP",MA
0000789283,6189,"CAPITAL SENIOR LIVING COMMUNITIES L P",TX
0000789951,6189,"AMERICA FIRST PARTICIPATING PREFERRED EQUITY MORTGAGE FUND",NE
0000789952,6189,"AMERICA FIRST PARTICIPATING PREFERRED EQUITY MORTGA FUND L P",NE
0000790524,6189,"CORNERSTONE MORTGAGE INVESTMENT GROUP INC",MO
0000791344,6189,"RESIDENTIAL RESOURCES INC",CA
0000792428,6189,"GE CAPITAL MORTGAGE SERVICES INC",NJ
0000792924,6189,"SUMMIT TAX EXEMPT L P II",NY
0000793038,6189,"KEYSTONE MORTGAGE FUND",CA
0000793245,6189,"AMERICA FIRST TAX EXEMPT MORTGAGE FUND 2 LTD PARTNERSHIP",NE
0000793278,6189,"CMC SECURITIES CORP I",TX
0000793467,6189,"INVG GOVERNMENT SECURITIES CORP",NV
0000793579,6189,"GNLV CORP",NV
0000793951,6189,"JHM ACCEPTANCE CORP III",VA
0000797510,6189,"ASSET BACKED SECURITIES CORP",NY
0000798533,6189,"CAPITAL GROWTH MORTGAGE INVESTORS L P",NY
0000799276,6189,"NORTH SIDE CAPITAL CORP",NY
0000799630,6189,"MORTGAGE SECURITIES III TRUSTS B",CA
0000801543,6189,"SOURCE ONE MORTGAGE SERVICES CORP",MI
0000802106,6189,"CREDIT SUISSE FIRST BOSTON MORTGAGE SECURITIES CORP",NY
0000805297,6189,"KRUPP INSURED PLUS II LTD PARTNERSHIP",MA
0000806515,6189,"WFS REPUBLIC INC",CA
0000806641,6189,"SCA TAX EXEMPT FUND LIMITED PARTNERSHIP",MD
0000806741,6189,"BEAR STEARNS SECURED INVESTORS INC",TX
0000807641,6189,"GS MORTGAGE SECURITIES CORP",NY
0000808264,6189,"MORTGAGE SECURITIES III TRUSTS D",CA
0000808363,6189,"CWM MORTGAGE TRUST 1996-1",CA
0000808434,6189,"INLAND MORTGAGE INVESTORS FUND LP II",IL
0000808851,6189,"STRUCTURED ASSET SECURITIES CORP",NY
0000809767,6189,"CORNERSTONE MORTGAGE INVESTMENT GROUP II INC",MO
0000809877,6189,"SALOMON BROTHERS MORTGAGE SECURITIES VII INC",NY
0000809940,6189,"MERRILL LYNCH MORTGAGE INVESTORS INC",NY
0000811493,6189,"FINANCIAL ASSET SECURITIZATION INC",VA
0000811500,6189,"PRUDENTIAL SECURITIES FINANCIAL ASSET FUNDING CORP",NY
0000811785,6189,"CITICORP MORTGAGE SECURITIES INC",MO
0000812084,6189,"KEYSTONE MORTGAGE FUND II",CA
0000812220,6189,"SUMMIT TAX EXEMPT L P III",NY
0000814144,6189,"MORTGAGE SECURITIES III TRUSTS C",CA
0000814703,6189,"RURAL ELECTRIC COOPERATIVE GRANTOR TRUST SOYLAND 1987 A-5",VA
0000814704,6189,"RURAL ELECTRIC COOPERATIVE GRANTOR TRUST SOYLAND 1987-A-6",VA
0000814826,6189,"KP WINGATE INSURED PARTNERS LIMITED PARTNERSHIP",MA
0000815018,6189,"MORTGAGE ASSET SECURITIZATION TRANSACTIONS INC",NY
0000816512,6189,"VANDERBILT MORTGAGE & FINANCE INC",TN
0000819975,6189,"CHASE BANK USA, NATIONAL ASSOCIATION",DE
0000820899,6189,"GLENDALE FEDERAL BANK FEDERAL SAVINGS BANK",CA
0000821203,6189,"EAGLE INSURED L P",NY
0000822522,6189,"CAPITAL REALTY INVESTORS TAX EXEMPT FUND III LTD PARTNERSHIP",MD
0000822760,6189,"ML ASSET BACKED CORP",NY
0000823980,6189,"FUND AMERICA INVESTORS CORP",CO
0000824093,6189,"ROYALTY MORTGAGE INCOME FUND",CA
0000825275,6189,"AMERICA FIRST PARTICIPATING PREFERRED EQUITY MORT FUND 2 LP",NE
0000825309,6189,"CHASE FUNDING INC",NJ
0000826219,6189,"RBS Acceptance Inc.",MD
0000826488,6189,"MORTGAGE SECURITIES III TRUSTS E",CA
0000826595,6189,"TECHNOLOGY FUNDING VENTURE PARTNERS IV",CA
0000828740,6189,"MOUNTAIN STATES GUARANTY MORTGAGE CO",CO
0000829281,6189,"LEHMAN ABS CORP",NY
0000830379,6189,"CHASE MORTGAGE FINANCE CORP",NJ
0000830431,6189,"MORTGAGE SECURITIES III TRUSTS F",CA
0000830753,6189,"CHASE MANHATTAN BANK USA NATIONAL ASSOCIATION",DE
0000832087,6189,"SRFG INC",DE
0000832091,6189,"KRUPP INSURED PLUS III LIMITED PARTNERSHIP",MA
0000832095,6189,"KRUPP INSURED MORTGAGE LIMITED PARTNERSHIP",MA
0000832329,6189,"CHASE MANHATTAN ACCEPTANCE CORP /DE/",NJ
0000832500,6189,"FIRST USA BANK N A",DE
0000833210,6189,"JCP RECEIVABLES INC",TX
0000833374,6189,"PREMIER ACCEPTANCE CORP /MN/",MN
0000834163,6189,"CREDIT SUISSE FIRST BOSTON MORTGAGE ACCEPTANCE CORP",NY
0000835271,6189,"JPMorgan Chase Bank, N.A.",OH
0000837757,6189,"TRANSAMERICA OCCIDENTAL LIFE INSURANCE CO /CA/",CA
0000838440,6189,"FIA Card Services, National Association",DE
0000839424,6189,"CITICORP NORTH AMERICA INC",NY
0000839461,6189,"JHM ACCEPTANCE CORP",DE
0000839849,6189,"PRUDENTIAL SECURITIES SECURED FINANCING CORP",NY
0000839947,6189,"CITIBANK SOUTH DAKOTA N A",NY
0000839948,6189,"CITIBANK NEVADA NATIONAL ASSOCIATION",SD
0000840253,6189,"HOUSING SECURITIES INC /NY/",NY
0000841129,6189,"INLAND MORTGAGE INVESTORS FUND III LP",IL
0000841535,6189,"GOVERNMENT BACKED TRUST T-1",NY
0000841536,6189,"GOVERNMENT BACKED TRUST T-2",NY
0000841537,6189,"GOVERNMENT BACKED TRUST T-3",NY
0000841975,6189,"GATEWAY MORTGAGE ACCEPTANCE CORP",IL
0000842810,6189,"HIBERNIA NATIONAL BANK",LA
0000842814,6189,"GOVERNMENT SECURITIES TRUST J 1",NY
0000842907,6189,"GOVERNMENT BACKED TRUST T 4",NY
0000844217,6189,"TECHNOLOGY FUNDING SECURED INVESTORS III",CA
0000844327,6189,"AMERICA FIRST PREP FUND 2 LIMITED PARTNERSHIP",NE
0000844414,6189,"NYLIFE GOVERNMENT MORTGAGE PLUS LTD PARTNERSHIP",NY
0000846607,6189,"BEAR STEARNS ASSET BACKED INVESTORS CORP",NY
0000847433,6189,"CML CHURCH MORTGAGE INC",TX
0000850779,6189,"WELLS FARGO COMMERCIAL MORTGAGE SECURITIES INC",NC
0000854498,6189,"MERRILL LYNCH HOME EQUITY ACCEPTANCE INC",FL
0000854760,6189,"PROVIDIAN NATIONAL BANK /NEW/",NH
0000856139,6189,"GOVERNMENT TRUST M 1",NY
0000856417,6189,"CHEVY CHASE BANK FSB",MD
0000856932,6189,"FIRST AMERICAN BANK OF VA",VA
0000857098,6189,"PAINEWEBBER INSURED MORTGAGE PARTNERS 1-B L P",MA
0000857344,6189,"ROYALTY MORTGAGE INCOME FUND II",CA
0000862026,6189,"DELTA FUNDING CORP /DE/",NY
0000863491,6189,"WELLS FARGO BANK IOWA NATIONAL ASSOCIATION",IA
0000863656,6189,"HOMESIDE MORTGAGE SECURITIES INC /DE/",FL
0000863856,6189,"FIRST CHICAGO MASTER TRUST II",DE
0000863899,6189,"FIRST CHURCH FINANCING CORP",WI
0000864602,6189,"ROYALTY MORTGAGE INCOME FUNDS III",CA
0000864603,6189,"ROYALTY MORTGAGE INCOME FUNDS IV",CA
0000864604,6189,"ROYALTY MORTGAGE INCOME FUNDS V",CA
0000866467,6189,"BANK OF THE WEST /CA/",CA
0000866753,6189,"MORTGAGE SECURITIES TRUST CMO SERIES I",NY
0000867203,6189,"CML CHURCH MORTGAGE TRUST 1990 RATED SERIES A-1",TX
0000867961,6189,"NAVISTAR FINANCIAL SECURITIES CORP",IL
0000869090,6189,"JPMORGAN CHASE BANK, NATIONAL ASSOCIATION",OH
0000869504,6189,"SPARDEES REALTY INC",CA
0000869739,6189,"GMAC AUTO RECEIVABLES CORP",DE
0000870490,6189,"CAPITOL HOME EQU LN TR 1990-1 CA HM EQ LN AS BK CE SE 1990-1",MD
0000870496,6189,"GOVERNMENT TRUST G 2",NY
0000870872,6189,"SECURITY PACIFIC HOME EQUITY TRUST 1991-A",MD
0000871663,6189,"FLEETWOOD CREDIT RECEIVABLES CORP",CA
0000872108,6189,"CONTITRADE SERVICES CORP",NY
0000872471,6189,"Ford Credit Floorplan Corp",MI
0000872551,6189,"GMAC 1991-A GRANTOR TRUST",MI
0000872552,6189,"GMAC 1991-B GRANTOR TRUST",MI
0000872553,6189,"GMAC 1991-C GRANTOR TRUST",MI
0000873446,6189,"CARCO AUTO LOAN MASTER TRUST",MI
0000874256,6189,"MERRILL LYNCH MORTGAGE CAPITAL INC",NY
0000874264,6189,"CHASE MANHATTAN CREDIT CARD MASTER TRUST",DE
0000877157,6189,"PIPER MORTGAGE ACCEPTANCE CORP",MN
0000877800,6189,"SCFC RECREATIONAL VEHICLE LOAN TRUST 1991-1",DE
0000877829,6189,"MBNA AMERICA BK NAT ASSOC MBNA MASTER CREDIT CARD TRUST",DE
0000878032,6189,"NISSAN AUTO RECEIVABLES CORP /DE",CA
0000878235,6189,"COMMERCIAL MORTGAGE RESOURCES CORP",AZ
0000878517,6189,"CAPSTEAD SECURITIES CORPORATION IV",TX
0000878640,6189,"DISCOVER CARD TRUST 1991 B",DE
0000878721,6189,"GOVERNMENT TRUST PH-1",NY
0000879765,6189,"DISCOVER CARD TRUST 1991 C",DE
0000879766,6189,"DISCOVER CARD TRUST 1991 D",DE
0000880648,6189,"DISCOVER CARD TRUST 1991 E",DE
0000880649,6189,"DISCOVER CARD TRUST 1991 F",DE
0000880996,6189,"MONEY STORE D C INC",CA
0000882135,6189,"FORD CREDIT AUTO LOAN MASTER TRUST",MI
0000882234,6189,"GMAC 1992-A GRANTOR TRUST",MI
0000882239,6189,"GMAC 1992-C GRANTOR TRUST",MI
0000882240,6189,"GMAC 1992-D GRANTOR TRUST",MI
0000882243,6189,"GMAC 1992-F GRANTOR TRUST",MI
0000882253,6189,"STRUCTURED ASSET MORTGAGE INVESTMENTS INC",NY
0000882590,6189,"NAVISTAR FINANCIAL RETAIL RECEIVABLES CORP",IL
0000884033,6189,"FIRST BOSTON MORTGAGE SEC CORP CON MOR PAS THR CER SE 1992-1",CA
0000884099,6189,"CARGILL FINANCIAL SERVICES CORP",MN
0000884936,6189,"SCFC BOAT LOAN TRUST 1992-1",DE
0000886193,6189,"PRUDENTIAL BANK & TRUST CO /GA/",GA
0000887507,6189,"CMC SECURITIES CORP IV",TX
0000887508,6189,"CMC SECURITIES CORP III",TX
0000887616,6189,"AMERICAN EXPRESS MASTER TRUST",NY
0000887617,6189,"AMERICAN EXPRESS RECEIVABLES FINANCING CORP",NY
0000888859,6189,"COLLATERAL INVESTMENT CORP",AL
0000888874,6189,"NOMURA ASSET ACCEPTANCE CORP",NY
0000888945,6189,"FIRST CONSUMERS NATIONAL BANK",OR
0000889416,6189,"FIRESTONE RETAIL CREDIT CORP",MA
0000889417,6189,"ASSET SECURITIZATION CORP",NY
0000889472,6189,"DYNEX SECURITIES CORP",VA
0000889474,6189,"EXPORT FUNDING CORP",NC
0000889604,6189,"FLEET CREDIT CARD MASTER TRUST",PA
0000889668,6189,"John Deere Receivables, Inc.",NV
0000890175,6189,"CONSECO FINANCE CORP",MN
0000890493,6189,"FIRST USA CREDIT CARD MASTER TRUST",DE
0000890965,6189,"ALLEN TEST DR I",MD
0000890975,6189,"AMERICAN HONDA RECEIVABLES LLC",CA
0000891317,6189,"AUTOMOBILE CREDIT FINANCE INC",TX
0000892286,6189,"PRIME RECEIVABLES CORP",OH
0000892287,6189,"PRIME CREDIT CARD MASTER TRUST",OH
0000892707,6189,"DISCOVER CARD TRUST 1992 A",DE
0000892833,6189,"ARGENT CAPITAL CORP",NV
0000892973,6189,"HONDA AUTO RECEIVABLES 1992-A GRANTOR TRUST",CA
0000892994,6189,"BOULEVARD AUTO TRUST 1992-1",IL
0000893331,6189,"FIRST CONSUMERS MASTER TRUST",NY
0000893709,6189,"Bank of Scotland plc",X0
0000893868,6189,"CITIBANK NEW YORK STATE",NY
0000893958,6189,"CAPITAL AUTO RECEIVABLES LLC",DE
0000894327,6189,"DISCOVER BANK",DE
0000894329,6189,"DISCOVER CARD MASTER TRUST I",DE
0000894344,6189,"DISCOVER CARD TRUST 1992-B",DE
0000894356,6189,"STRUCTURED PRODUCTS CORP",NY
0000894360,6189,"WHOLESALE AUTO RECEIVABLES LLC",DE
0000894377,6189,"CORESTATES BANK N A /PA",PA
0000894378,6189,"NEW JERSEY NATIONAL BANK /NJ",NJ
0000894654,6189,"FREMONT FUNDING INC",CA
0000895035,6189,"SECURITIZED ASSET SALES INC",MD
0000895472,6189,"MERRILL LYNCH MUNICIPAL ABS INC",NY
0000895656,6189,"AUTO FUNDING II L P",NY
0000895730,6189,"FUND AMERICA INVESTORS CORP II",CO
0000895731,6189,"CMC SECURITIES CORP II",TX
0000896244,6189,"DISCOVER CARD TRUST 1993-A",DE
0000896245,6189,"DISCOVER CARD TRUST 1993-B",DE
0000896328,6189,"FORD CREDIT 1993-A GRANTOR TRUST",MI
0000896982,6189,"ARCADIA RECEIVABLES FINANCE CORP",TX
0000897433,6189,"WACHOVIA SBA LENDING INC SERIES 1999-1",NJ
0000897434,6189,"MONEY STORE OF NEW YORK INC",CA
0000897505,6189,"HYUNDAI AUTO RECEIVABLES TRUST 1993-A",CA
0000897845,6189,"SUPERIOR BANK FSB",IL
0000897897,6189,"EQCC RECEIVABLES CORP",FL
0000897898,6189,"EQCC ASSET BACKED CORP",FL
0000899287,6189,"PROVIDIAN NATIONAL BANK",NH
0000899290,6189,"CHASE USA MASTER TRUST",DE
0000900472,6189,"IMPERIAL GOVERNMENT INCOME TRUST SERIES I",CA
0000901488,6189,"UCFC ACCEPTANCE CORP",LA
0000901833,6189,"ADVANTA MORTGAGE CONDUIT SERVICES INC",PA
0000902266,6189,"NOMURA SECURITIES INTERNATIONAL INC",NY
0000904016,6189,"ZIONS FIRST NATIONAL BANK /USA/",UT
0000905030,6189,"HOST MARRIOTT HOSPITALITY INC",MD
0000905604,6189,"BANK ONE AUTO GRANTOR TRUST 1997-A",TX
0000906111,6189,"PEOPLES BANK",CT
0000906286,6189,"DLJ MOR ACCEP CORP MUL FAMI MOR PASS THRO CERT SER 1992-MF3",NY
0000906327,6189,"HOUSEHOLD AFFINITY FUNDING CORP",IL
0000906328,6189,"HOUSEHOLD FINANCE CORP HOUSEHOLD AFF CRE CAR MAS TR I",IL
0000906410,6189,"CWMBS INC",CA
0000906521,6189,"MORTGAGE CAPITAL FUNDING INC",NY
0000906561,6189,"TMS MORTGAGE INC",CA
0000906938,6189,"FIRST ALLIANCE MORTGAGE CO /DE/",CA
0000908392,6189,"USAA FEDERAL SAVINGS BANK",TX
0000908599,6189,"TOYOTA MOTOR CREDIT RECEIVABLES CORP",CA
0000908603,6189,"FORD CREDIT 1993-B GRANTOR TRUST",MI
0000908987,6189,"BEAR STEARNS COMMERCIAL MORTGAGE SECURITIES INC",NY
0000909826,6189,"FIRST DEPOSIT NAT BK FIRST DEP MAS TR ASST BK CER SER 1993-2",NH
0000909962,6189,"FEDERAL MORTGAGE MANAGEMENT INC",FL
0000910224,6189,"MMCA AUTO RECEIVABLES INC",CA
0000910226,6189,"MMCA AUTO GRANTOR TRUST 1993-1",CA
0000910243,6189,"CSXT TRADE RECEIVABLES MASTER TRUST",VA
0000910869,6189,"HUNTINGTON RESIDENTIAL MORTGAGE SECURITIES INC",OH
0000911023,6189,"CHASE COMMERCIAL MORTGAGE SECURITIES CORP",NY
0000911423,6189,"DAIMLER BENZ AUTO GRANTOR TRUST 1993-A",DE
0000911703,6189,"CSX TRADE RECEIVABLES CORP",VA
0000912032,6189,"ORIENTAL FEDERAL MORTGAGE TRUST 1993-1",PR
0000912265,6189,"IBM CREDIT RECEIVABLES INC",NY
0000912541,6189,"BOMBARDIER CREDIT RECEIVABLES CORP",VT
0000912542,6189,"BOMBARDIER RECEIVABLES MASTER TRUST I",VT
0000912838,6189,"NATIONSBANK OF DELAWARE NA",AZ
0000912957,6189,"AMERICAN SOUTHWEST FINANCIAL SECURITIES CORP",AZ
0000913570,6189,"VENTURE LENDING & LEASING INC",CA
0000913951,6189,"AAMES CAPITAL CORP",CA
0000914063,6189,"CDF FLOORPLAN RECEIVABLES LP",NY
0000914064,6189,"DISTRIBUTION FINANCIAL SERVICES FLOORPLAN MASTER TRUST /NY",NY
0000915120,6189,"IBM CREDIT RECEIVABLES LEASE ASSET MASTER TRUST",NY
0000916095,6189,"YAMAHA MOTOR RECEIVABLES CORP",CA
0000916745,6189,"PEOPLES BANK CREDIT CARD MASTER TRUST",CT
0000916791,6189,"CORPORATE ASSET BACKED CORP",NY
0000917248,6189,"PAINEWEBBER MORTGAGE ACCEPTANCE CORP V",NY
0000917313,6189,"CHARMING SHOPPES MASTER TRUST",DE
0000917819,6189,"CONTISECURITIES ASSET FUNDING CORP",NV
0000918113,6189,"DVI RECEIVABLES CORP",PA
0000918643,6189,"MORSERV INC",NJ
0000919815,6189,"CWMBS INC MORT PASS THRO CERT SER 1994-8",CA
0000920031,6189,"CREDIT SUISSE FIRST BOSTON STRUCTURED PRODUCTS CORP",NY
0000920193,6189,"CWMBS INC MORTGAGE PASS THRO CERT SERIES 1993-1",CA
0000920199,6189,"CWMBS INC MORTGAGE PASS THRO CERT SERIES 1993-12",CA
0000920247,6189,"CWMBS INC 1994-5 MORTGAGE PASS THRO CERT SERIES 1994-5",CA
0000920343,6189,"WORLD OMNI LEASE SECURITIZATION L P /DE/",FL
0000920466,6189,"MORGAN J P STRUCTURED FINANCE CORP",NY
0000920628,6189,"CC MASTER CREDIT CARD TRUST",TX
0000920852,6189,"USA GROUP SECONDARY MARKET SERVICES INC",IN
0000921143,6189,"CS FBC MORTGAGE SECURITIES TRUST 22 OF CS FIRST BOSTON MOR S",NY
0000921529,6189,"EQUICON MORTGAGE LOAN TRUST 1994-1",MD
0000921686,6189,"MLCC MORTGAGE INVESTORS INC",FL
0000921751,6189,"FINGERHUT RECEIVABLES INC",GA
0000921752,6189,"FINGERHUT MASTER TRUST",MN
0000921864,6189,"CITIBANK CREDIT CARD MASTER TRUST I",SD
0000922546,6189,"CWMBS INC MORTGAGE PASS THROUGH CERTIFICATES SERIES 1994-4",CA
0000922869,6189,"CAPITAL ONE MASTER TRUST",VA
0000923147,6189,"HSBC HOME EQUITY LOAN CORP I",IL
0000923261,6189,"HONDA AUTO RECEIVABLES 1994-A GRANTOR TRUST",CA
0000923569,6189,"CITIBANK OMNI-S MASTER TRUST",SD
0000924209,6189,"RURAL ELECTRIC COOPERATIVE GRANTOR TRUST SOYLAND 1993 B1",VA
0000924210,6189,"RURAL ELECTRIC COOPERATIVE GRANTOR TRUST SOYLAND 1993 B2",VA
0000924381,6189,"DAIMLER BENZ VEHICLE RECEIVABLES CORP",DE
0000924382,6189,"DAIMLER BENZ VEHICLE TRUST 1994-A",DE
0000924992,6189,"FLEET CREDIT CARD MASTER TRUST II",DE
0000925433,6189,"ML PRINCIPAL PROTECTION TRADING LP",NY
0000926216,6189,"FIRST DEPOSIT NATL BK FIRST DEP MA TR AS BK CERT SER 1994-1",NH
0000927655,6189,"AFG RECEIVABLES CORP",IL
0000927764,6189,"ONYX ACCEPTANCE FINANCIAL CORP",CA
0000928378,6189,"NATIONSBANK NA",NC
0000928596,6189,"FIRST NORTH AMERICAN NATIONAL BANK",GA
0000928597,6189,"CIRCUIT CITY CREDIT CARD MASTER TRUST",DE
0000928898,6189,"LEHMAN HOME EQUITY LOAN TRUST 1994-1",IL
0000929541,6189,"OAKWOOD MORTGAGE INVESTORS INC",NV
0000929543,6189,"WORLD OMNI DEALER FUNDING INC",FL
0000930299,6189,"COPELCO CAPITAL FUNDING CORP II",NJ
0000930459,6189,"BANC ONE CREDIT CARD MASTER TRUST",DE
0000930559,6189,"CHASE MANHATTAN BANK N A",NY
0000930743,6189,"WACHOVIA COMMERCIAL MORTGAGE INC 1999-1",CA
0000931152,6189,"CNH RECEIVABLES INC",IL
0000931494,6189,"CIT GROUP SECURITIZATION CORP II",NJ
0000931781,6189,"SPIEGEL CREDIT CORP III",IL
0000931866,6189,"SPIEGEL CREDIT CORP III",DE
0000932131,6189,"AUTO ONE SECURITIZATION CORP",TX
0000932625,6189,"FIRST FEDERAL SAVINGS BANK OF PUERTO RICO",PR
0000932858,6189,"RESIDENTIAL ASSET SECURITIES CORP",MN
0000933505,6189,"EQUIVANTAGE ACCEPTANCE CORP",TX
0000934377,6189,"BANC OF AMERICA FUNDING CORP",MD
0000934841,6189,"NATIONAL CITY BANK OF MICHIGAN / ILLINOIS",OH
0000934843,6189,"NATIONAL CITY CREDIT CARD MASTER TRUST",OH
0000934844,6189,"NEIMAN MARCUS FUNDING CORP",TX
0000936157,6189,"MID STATE TRUST IV",DE
0000936514,6189,"BENEFICIAL MORTGAGE CORP",DE
0000936988,6189,"BA Master Credit Card Trust II",DE
0000937863,6189,"COPELAND COMPANIES",NJ
0000937940,6189,"MERCANTILE CREDIT CARD MASTER TRUST",IL
0000939663,6189,"NOMURA ASSET SEC CORP COM MORT PAS THRO CER SER 1994-C3",IL
0000940182,6189,"FCC RECEIVABLES CORP",UT
0000942177,6189,"FIRST SECURITY BANK NA",UT
0000943489,6189,"CitiMortgage, Inc.",MO
0000943551,6189,"PDC 1994-D LIMITED PARTNERSHIP",WV
0000943570,6189,"WESTPOINT STEVENS REC MAS TR FL RT TRAD REC PAR CE SE 1994-1",GA
0000943630,6189,"RYLAND MORTGAGE SECURITIES CORP SERIES 1995-1 MORT PARTICIP",MD
0000943970,6189,"HOUSEHOLD REVOLVING HOME EQUITY LOAN TRUST 1995-1",IL
0000944714,6189,"GUARANTEED EXPORT TRUSTS PDVSA 1996 A",NY
0000944743,6189,"SOUTHERN PACIFIC SECURED ASSETS CORP",MD
0000945197,6189,"CHEVY CHASE AUTO RECEIVABLES TRUST 1995-1",MD
0000945207,6189,"HOUSEHOLD PRIVATE LABEL CREDIT CARD MASTER TRUST II",IL
0000945212,6189,"RESIDENTIAL FUNDING MORTGAGE SECURITIES II INC",MN
0000945220,6189,"SAXON MORTGAGE SECURITIES CORP SERIES 1995-1 TRUST",MD
0000945316,6189,"CCB HOLDING CORP",DE
0000945362,6189,"FIRST ALLIANCE MORTGAGE LOAN TRUST 1995-1",CA
0000945479,6189,"HOUSEHOLD CAPITAL TRUST I",IL
0000945480,6189,"EQUICON MORTGAGE LOAN TRUST 1995-1",MD
0000946071,6189,"FIRST SECURITY AUTO GRANTOR TRUST 1995-A",UT
0000946115,6189,"TARGET RECEIVABLES CORP",MN
0000946812,6189,"BEAR STEARNS ASSET BACKED SECURITIES INC",NY
0000947117,6189,"UNIVERSAL BANK NA",GA
0000947183,6189,"AT&T UNIVERSAL CARD MASTER TRUST",NY
0000947875,6189,"HONDA AUTO RECEIVABLES 1995-A GRANTOR TRUST",CA
0000947902,6189,"CHASE MANHATTAN GRANTOR TRUST 1995-A",NY
0000947991,6189,"CAPMARK MORTGAGE SECURITIES INC",PA
0000948042,6189,"VANDERBILT MORT & FIN INC MAN HO CO SE SU PA TH CE SE 1995-A",TN
0000948268,6189,"CRIIMI MAE FINANCIAL CORP",MD
0000948409,6189,"CATERPILLAR FINANCIAL FUNDING CORP",NV
0000948710,6189,"TL LEASE FUNDING CORP IV",DE
0000948847,6189,"HOUSEHOLD CONSUMER LOAN CORP",IL
0000948848,6189,"HOUSEHOLD FINANCE CORP HOUSEHOLD CONSUMER LN TRUST 1995-1 /",IL
0000949114,6189,"NAVIENT FUNDING, LLC",VA
0000949348,6189,"AMERICAN EXPRESS CENTURION BANK",UT
0000949349,6189,"AMERICAN EXPRESS RECEIVABLES FINANCING CORP II",NY
0000949372,6189,"PRUDENTIAL SECURITIES STRUCTURED ASSETS INC",NY
0000949493,6189,"RESIDENTIAL ACCREDIT LOANS INC",MN
0000949966,6189,"TAMARACK LENDERS CORP",TX
0000950173,6189,"BEAR STEARNS AST BACK SEC INC MSTR FIN AST SEC TRUST 1997-1",NY
0000950174,6189,"CWMBS INC MORT PASS THRO CERT SER 1997-8",CA
0000950175,6189,"VANDERBILT MORT & FIN INC SEN SUB PAS THR CERT SER 1999C",TN
0001000112,6189,"CC MASTER CREDIT CARD TRUST II",DE
0001000512,6189,"HOUSEHOLD CONSUMER LOAN DEPOSIT TRUST I",IL
0001000661,6189,"CENTERIOR FUNDING CORP",DE
0001000801,6189,"DAIMLER BENZ AUTO GRANTOR TRUST 1995-A",DE
0001001297,6189,"ASSET SECURITIZATION CORP COMM MOR PASS THR CERT SER 1995-D1",IL
0001001321,6189,"ADVANTA NATIONAL BANK",DE
0001001325,6189,"FIRST DEPOSIT NATL BK FIRST DEP MA TR AS BK CER SER 1993-1",NH
0001001329,6189,"HOUSEHOLD CREDIT CARD MASTER TRUST I",IL
0001001331,6189,"FIRST DEP NATL BK FIRST DEP MA TR FL RA AS BK CE SE 1995-1",NH
0001001334,6189,"FIRST DEPOSIT NATL BK FIRST DEP MA TR AS BK CER SER 1995-2",NH
0001001392,6189,"UACSC AUTO TRUSTS",FL
0001001541,6189,"NATIONSBANK NA /NC/",NC
0001001679,6189,"NAVISTAR FINANCIAL DEALER NOTE MASTER TRUST",IL
0001001735,6189,"MMCA AUTO OWNER TRUST 1995-1",CA
0001002136,6189,"SIGNET HELOC TRUST 1995-A",VA
0001002226,6189,"HOUSEHOLD REVOLVING HOME EQUITY LOAN TRUST 1995-2",IL
0001002439,6189,"CHASE BANK USA, NA AS SERVIC ON BEHALF WACHOVIA CREDIT CARD MASTER TRUST",DE
0001002471,6189,"CHASE MANHATTAN GRANTOR TRUST 1995-B",NY
0001002485,6189,"YAMAHA MOTOR MASTER TRUST",CA
0001002578,6189,"NEWCOURT RECEIVABLES CORP",IN
0001002669,6189,"EQUICON MORTGAGE LOAN TRUST 1995-2",MD
0001002711,6189,"FIRST UNION NATIONAL BANK OF GEORGIA \",NC
0001002761,6189,"AMERICREDIT FINANCIAL SERVICES INC",TX
0001002858,6189,"THIRD AVENUE MANAGEMENT LLC",NY
0001002934,6189,"FIRST SIERRA RECEIVABLES II INC",TX
0001003010,6189,"SUPERIOR WHOLESALE INVENTORY FINANCING TRUST I",MI
0001003197,6189,"FINANCIAL ASSET SECURITIES CORP",CT
0001003509,6189,"AMERICAN EXPRESS CREDIT ACCOUNT MASTER TRUST",UT
0001003522,6189,"AMRESCO RESIDENTIAL SECURITIES CORP",TX
0001003563,6189,"METRIS RECEIVABLES INC",IL
0001003564,6189,"METRIS MASTER TRUST",IL
0001003587,6189,"CHEVY CHASE AUTO RECEIVABLES TRUST 1995-2",MD
0001003842,6189,"WFS FINANCIAL 1997-A OWNERS TRUST",CA
0001003844,6189,"WFS FINANCIAL 1996-B OWNER TRUST",DE
0001003846,6189,"WFS FINANCIAL 1996-C OWNER TRUST",DE
0001003854,6189,"CHASE MANHATTAN GRANTOR TRUST 1996-A",NY
0001003952,6189,"CAPITAL ONE BANK",VA
0001004024,6189,"EQUIVANTAGE HOME EQUITY LOAN TRUST 1995-2",MD
0001004025,6189,"UACSC 1995-D AUTO TRUST",IN
0001004150,6189,"WORLD OMNI FINANCIAL CORP",FL
0001004158,6189,"GS MORTGAGE SECURITIES CORP II",NY
0001004459,6189,"EQCC HOME EQUITY LOAN TRUST 1995-4",FL
0001004463,6189,"OAKWOOD MORTGAGE INVESTORS INC OMI TRUST 1995-B",NC
0001004539,6189,"AIRPLANES LTD",X0
0001004540,6189,"AIRPLANES US TRUST",DE
0001004594,6189,"SALOMON BROTHERS MORT SEC VII INC MOR PAS TH CER SER 1995-2",NY
0001004595,6189,"SALOMON BROTHERS MORT SEC VII INC MOR PAS TH CER SER 1995-3",NY
0001004642,6189,"VOLKSWAGEN CREDIT AUTO RECEIVABLES CORP",MI
0001004988,6189,"CHASE CREDIT CARD MASTER TRUST",DE
0001005007,6189,"Banc of America Merrill Lynch Commercial Mortgage Inc.",NC
0001005008,6189,"BOMBARDIER CR RE COR B R M TR I FI R CL B AS BK CE SE 1994-1",VT
0001005022,6189,"TMS AUTO HOLDINGS INC",CA
0001005162,6189,"FIRST ALLIANCE MORTGAGE LOAN TRUST 1995-2",CA
0001005290,6189,"RELIABLE FINANCIAL SERVICES INC",PR
0001005292,6189,"FIRSTPLUS INVESTMENT CORP",NV
0001005403,6189,"NATIONSCREDIT SECURITIZATION CORP",PA
0001005404,6189,"NATIONSCREDIT GRANTOR TRUST 1996-1",GA
0001005405,6189,"NATIONAL FINANCIAL AUTO FUNDING TRUST",FL
0001005503,6189,"BOATMENS AUTO TRUST 1995-A",NC
0001005865,6189,"TRANSAMERICA CONSUMER MORTGAGE RECEIVABLES CORP",CA
0001006135,6189,"CHEMICAL MOR SEC INC MULTI CL MOR PAS THRO CER SER 1996-1",NY
0001006183,6189,"FIRST OMNI BANK NA",DE
0001006208,6189,"STRUCTURED ASSET SECURITIES CORP SERIES 1995-2",MD
0001007073,6189,"FIFTH THIRD BANK AUTO TRUST 1996-B",OH
0001007090,6189,"WORLD OMNI 1996-A AUTOMOBILE LEASE SECURITIZATION TRUST /DE",FL
0001007119,6189,"HOUSEHOLD CONSUMER LOAN TRUST 1996-1",IL
0001007254,6189,"WORLD FINANCIAL NETWORK NATIONAL BANK",OH
0001007452,6189,"BANC ONE AUTO GRANTOR TRUST 1996-A",TX
0001007575,6189,"TA OF DELAWARE INC",MA
0001008617,6189,"ACCESS FINANCIAL MORTGAGE LOAN TRUST 1996-1",MD
0001008949,6189,"FORD CREDIT AUTO RECEIVABLES TWO L P",MI
0001008966,6189,"FIRST NATIONS FINANCIAL SERVICES CO",DE
0001009246,6189,"EQCC HOME EQUITY LOAN TRUST 1996-1",FL
0001009248,6189,"UACSC 1996-A AUTO TRUST",TN
0001009722,6189,"EQUIVANTAGE HOME EQUITY LOAN TRUST 1996-1",MD
0001010317,6189,"DLJ MORTGAGE ACCEPTANCE CORP MORT PASS THR CERT SER 1996-Q4",NY
0001010319,6189,"DLJ MORTGAGE ACCEPTANCE CORP MORT PASS THR CERT SER 1996-Q1",NY
0001010320,6189,"DLJ MORTGAGE ACCEPTANCE CORP MORT PASS THR CERT SER 1996-QE3",NY
0001010373,6189,"CS FIRST BOSTON MOR SEC CORP COMM MOR PA TH CER SE 1995-AEW1",MA
0001010374,6189,"CWMBS INC MORTGAGE PASS THROUGH CERTIFICATES SERIES 1996-B",CA
0001010376,6189,"MORGAN STANLEY CAPITAL I INC MORT PASS THRO CERT SER 1996-1",NY
0001010377,6189,"AMRESCO RESIDENTIAL SECURITIES CORP MORT LOAN TRUST 1996-1",TX
0001010466,6189,"PRUDENTIAL SEC SECURED FIN COR COM MOR PA TH CE S 1995 MCF-2",IL
0001010495,6189,"NATIONAL COLLEGIATE TRUST 1996-S1",DE
0001010519,6189,"NELNET STUDENT LOAN CORP 1",AZ
0001010670,6189,"CWMBS INC MORTGAGE PASS THROUGH CERTIFICATES SERIES 1996-D",CA
0001010683,6189,"CBM FUNDING CORP",MD
